ts_utc	experiment_id	run_id	track	trainer	branch	commit	status	exit_code	exact_final_val_bpb	pre_quant_val_bpb	final_val_loss	pre_quant_val_loss	bytes_total	bytes_code	bytes_model	wallclock_seconds	step_stop	log_path	submission_path	notes
2026-03-20T21:41:19Z	20260320T214119Z_runpod_h100_1gpu_l11_d496_untied_verify_stride256_int4l9s4wc1750	20260320T214000Z_runpod_h100_1gpu_l11_d496_untied_verify_stride256_int4l9s4wc1750	runpod_h100	train_gpt.py	research/continuous-mar18	a52678d554d803bbb870d0ba832402b3449259a9	keep	0	1.22709876	1.2558	2.07190505	2.1204	15328816	58672	15270144	2195.639704	3276	/workspace/parameter-golf/logs/experiments/20260320T214119Z_runpod_h100_1gpu_l11_d496_untied_verify_stride256_int4l9s4wc1750.log		compression-pressure step4 for 9-layer int4 coverage at 1750s
2026-03-20T22:18:37Z	20260320T221837Z_runpod_h100_1gpu_l11_d496_untied_verify_stride256_int4l9s3wc1750	20260320T214300Z_runpod_h100_1gpu_l11_d496_untied_verify_stride256_int4l9s3wc1750	runpod_h100	train_gpt.py	research/continuous-mar18	a52678d554d803bbb870d0ba832402b3449259a9	keep	0	1.22516369	1.2551	2.06863776	2.1192	15942604	58672	15883932	2193.122439	3343	/workspace/parameter-golf/logs/experiments/20260320T221837Z_runpod_h100_1gpu_l11_d496_untied_verify_stride256_int4l9s3wc1750.log		compression-pressure step3 for 9-layer int4 coverage at 1750s
2026-03-20T22:56:36Z	20260320T225636Z_runpod_h100_1gpu_l11_d496_untied_verify_stride256_int4l9s2wc1750wd600	20260320T223000Z_runpod_h100_1gpu_l11_d496_untied_verify_stride256_int4l9s2wc1750wd600	runpod_h100	train_gpt.py	research/continuous-mar18	a52678d554d803bbb870d0ba832402b3449259a9	invalid	0	1.22349377	1.2537	2.06581816	2.1169	16711626	58672	16652954	2192.293312	3565	/workspace/parameter-golf/logs/experiments/20260320T225636Z_runpod_h100_1gpu_l11_d496_untied_verify_stride256_int4l9s2wc1750wd600.log		compression-pressure step2 with warmdown=600 at 1750s | bytes_total>16000000
2026-03-20T23:34:27Z	20260320T233427Z_runpod_h100_1gpu_l11_d496_untied_verify_stride256_int4l8s2wc1750	20260320T234000Z_runpod_h100_1gpu_l11_d496_untied_verify_stride256_int4l8s2wc1750	runpod_h100	train_gpt.py	research/continuous-mar18	a52678d554d803bbb870d0ba832402b3449259a9	invalid	0	1.22714286	1.2576	2.0719795	2.1233	16863477	58672	16804805	2195.712353	3157	/workspace/parameter-golf/logs/experiments/20260320T233427Z_runpod_h100_1gpu_l11_d496_untied_verify_stride256_int4l8s2wc1750.log		compression-pressure 8-layer int4 step2 at 1750s | bytes_total>16000000
2026-03-21T00:13:26Z	20260321T001326Z_runpod_h100_1gpu_l11_d496_untied_verify_stride256_int4l9s3wc1750_mwd001	20260320T235000Z_runpod_h100_1gpu_l11_d496_untied_verify_stride256_int4l9s3wc1750_mwd001	runpod_h100	train_gpt.py	research/continuous-mar18	a52678d554d803bbb870d0ba832402b3449259a9	keep	0	1.22676623	1.2563	2.07134358	2.1213	15036932	58672	14978260	2201.795871	2994	/workspace/parameter-golf/logs/experiments/20260321T001326Z_runpod_h100_1gpu_l11_d496_untied_verify_stride256_int4l9s3wc1750_mwd001.log		step3 frontier + muon weight decay 0.01 at 1750s
2026-03-21T00:54:51Z	20260321T005451Z_runpod_h100_1gpu_l11_d496_untied_verify_stride256_int4l9s3wc1750_mwd0005	20260321T005451Z_runpod_h100_1gpu_l11_d496_untied_verify_stride256_int4l9s3wc1750_mwd0005	runpod_h100	train_gpt.py	research/continuous-mar18	a52678d554d803bbb870d0ba832402b3449259a9	keep	0	1.22568755	1.2558	2.06952227	2.1203	15560642	58672	15501970	2196.882031	3110	logs/experiments/20260321T005451Z_runpod_h100_1gpu_l11_d496_untied_verify_stride256_int4l9s3wc1750_mwd0005.log	logs/experiments/20260321T005451Z_runpod_h100_1gpu_l11_d496_untied_verify_stride256_int4l9s3wc1750_mwd0005.json	precision-aware-compression frontier: int4 step3 + muon weight decay 0.005 at 1750s
2026-03-21T01:32:00Z	20260321T013200Z_runpod_h100_1gpu_l11_d496_untied_verify_stride256_int4l9s3wc1750_wd600	20260321T013200Z_runpod_h100_1gpu_l11_d496_untied_verify_stride256_int4l9s3wc1750_wd600	runpod_h100	train_gpt.py	research/continuous-mar18	a52678d554d803bbb870d0ba832402b3449259a9	keep	0	1.23075207	1.2609	2.0780735	2.129	15957310	58672	15898638	2197.800347	3004	logs/experiments/20260321T013200Z_runpod_h100_1gpu_l11_d496_untied_verify_stride256_int4l9s3wc1750_wd600.log	logs/experiments/20260321T013200Z_runpod_h100_1gpu_l11_d496_untied_verify_stride256_int4l9s3wc1750_wd600.json	frontier step3 baseline with warmdown 600
2026-03-21T02:08:59Z	20260321T020859Z_runpod_h100_1gpu_l11_d496_untied_verify_stride256_int4l9s3wc1750_mwd0010	20260321T020859Z_runpod_h100_1gpu_l11_d496_untied_verify_stride256_int4l9s3wc1750_mwd0010	runpod_h100	train_gpt.py	research/continuous-mar18	a52678d554d803bbb870d0ba832402b3449259a9	keep	0	1.22773645	1.2578	2.07298174	2.1237	15852562	58672	15793890	2193.908782	3121	logs/experiments/20260321T020859Z_runpod_h100_1gpu_l11_d496_untied_verify_stride256_int4l9s3wc1750_mwd0010.log		precision frontier continuation: int4 step3 + muon weight decay 0.001
2026-03-21T02:55:00Z	20260321T025500Z_runpod_h100_1gpu_l11_d496_untied_verify_stride256_int4l9s3wc1750_mwd0003	20260321T025500Z_runpod_h100_1gpu_l11_d496_untied_verify_stride256_int4l9s3wc1750_mwd0003	runpod_h100	train_gpt.py	research/continuous-mar18	a52678d554d803bbb870d0ba832402b3449259a9	keep	0	1.22501069	1.2551	2.06837942	2.1192	15754075	58672	15695403	2193.640394	3216	logs/experiments/20260321T025500Z_runpod_h100_1gpu_l11_d496_untied_verify_stride256_int4l9s3wc1750_mwd0003.log	./logs/experiments/20260321T025500Z_runpod_h100_1gpu_l11_d496_untied_verify_stride256_int4l9s3wc1750_mwd0003.json	precision frontier continuation: int4 step3 + muon weight decay 0.003
2026-03-21T03:32:59Z	20260321T033259Z_runpod_h100_1gpu_l11_d496_untied_verify_stride256_int4l9s3wc1750_mwd0004	20260321T033259Z_runpod_h100_1gpu_l11_d496_untied_verify_stride256_int4l9s3wc1750_mwd0004	runpod_h100	train_gpt.py	research/continuous-mar18	a52678d554d803bbb870d0ba832402b3449259a9	keep	0	1.2260329	1.2561	2.07010539	2.1208	15643891	58672	15585219	2195.247232	3131	logs/experiments/20260321T033259Z_runpod_h100_1gpu_l11_d496_untied_verify_stride256_int4l9s3wc1750_mwd0004.log	./logs/experiments/20260321T033259Z_runpod_h100_1gpu_l11_d496_untied_verify_stride256_int4l9s3wc1750_mwd0004.json	precision frontier continuation: int4 step3 + muon weight decay 0.004
2026-03-21T04:11:29Z	20260321T041029Z_runpod_h100_1gpu_l11_d496_untied_verify_stride256_int4l9s3wc1750_mwd0025	20260321T041029Z_runpod_h100_1gpu_l11_d496_untied_verify_stride256_int4l9s3wc1750_mwd0025	runpod_h100	train_gpt.py	research/continuous-mar18	a52678d554d803bbb870d0ba832402b3449259a9	keep	0	1.22745689	1.2575	2.07250973	2.1232	15736716	58672	15678044	2202.221225	3077	logs/experiments/20260321T041029Z_runpod_h100_1gpu_l11_d496_untied_verify_stride256_int4l9s3wc1750_mwd0025.log	logs/experiments/20260321T041029Z_runpod_h100_1gpu_l11_d496_untied_verify_stride256_int4l9s3wc1750_mwd0025.json	precision frontier continuation: int4 step3 + muon weight decay 0.0025
2026-03-21T04:48:07Z	20260321T044807Z_runpod_h100_1gpu_l11_d496_untied_verify_stride256_int4l9s3wc1750_mwd0006	20260321T044807Z_runpod_h100_1gpu_l11_d496_untied_verify_stride256_int4l9s3wc1750_mwd0006	runpod_h100	train_gpt.py	research/continuous-mar18	a52678d554d803bbb870d0ba832402b3449259a9	keep	0	1.22661448	1.2567	2.07108736	2.1218	15730586	58672	15671914	2206.441872	3119	logs/experiments/20260321T044807Z_runpod_h100_1gpu_l11_d496_untied_verify_stride256_int4l9s3wc1750_mwd0006.log	logs/experiments/20260321T044807Z_runpod_h100_1gpu_l11_d496_untied_verify_stride256_int4l9s3wc1750_mwd0006.json	precision frontier continuation: int4 step3 + muon weight decay 0.0028
2026-03-21T05:25:46Z	20260321T052546Z_runpod_h100_1gpu_l11_d496_untied_verify_stride256_int4l9s3wc1750_mwd0007	20260321T052546Z_runpod_h100_1gpu_l11_d496_untied_verify_stride256_int4l9s3wc1750_mwd0007	runpod_h100	train_gpt.py	research/continuous-mar18	a52678d554d803bbb870d0ba832402b3449259a9	keep	0	1.22647723	1.2565	2.07085561	2.1215	15684688	58672	15626016	2193.707946	3128	logs/experiments/20260321T052546Z_runpod_h100_1gpu_l11_d496_untied_verify_stride256_int4l9s3wc1750_mwd0007.log	logs/experiments/20260321T052546Z_runpod_h100_1gpu_l11_d496_untied_verify_stride256_int4l9s3wc1750_mwd0007.json	precision frontier continuation: int4 step3 + muon weight decay 0.0035
2026-03-21T06:11:03Z	20260321T061103Z_runpod_h100_1gpu_l11_d496_untied_verify_stride256_int4l9s3wc1750_mwd0008	20260321T061103Z_runpod_h100_1gpu_l11_d496_untied_verify_stride256_int4l9s3wc1750_mwd0008	runpod_h100	train_gpt.py	research/continuous-mar18	aba1726bb4601391fcbc734fd056d0d72760b40c	keep	0	1.22734251	1.2576	2.0723166	2.1234	15823067	58672	15764395	2196.328332	3182	logs/experiments/20260321T061103Z_runpod_h100_1gpu_l11_d496_untied_verify_stride256_int4l9s3wc1750_mwd0008.log	logs/experiments/20260321T061103Z_runpod_h100_1gpu_l11_d496_untied_verify_stride256_int4l9s3wc1750_mwd0008.json	precision frontier continuation: int4 step3 + muon 0.0035 + warmdown 600
2026-03-21T06:50:46Z	20260321T065046Z_20260321T073800Z_runpod_h100_1gpu_l11_d496_untied_verify_stride256_int4a11s3wc1750_mwd0009	20260321T065046Z_20260321T073800Z_runpod_h100_1gpu_l11_d496_untied_verify_stride256_int4a11s3wc1750_mwd0009	runpod_h100	train_gpt.py	research/continuous-mar18	a52678d554d803bbb870d0ba832402b3449259a9	keep	0	1.22853731	1.2582	2.07433397	2.1244	15180872	58672	15122200	2194.656263	3114	logs/experiments/20260321T065046Z_20260321T073800Z_runpod_h100_1gpu_l11_d496_untied_verify_stride256_int4a11s3wc1750_mwd0009.log	logs/experiments/20260321T065046Z_20260321T073800Z_runpod_h100_1gpu_l11_d496_untied_verify_stride256_int4a11s3wc1750_mwd0009.json	frontier compression topology: int4 layers 0-10 with step3 baseline + muon 0.0035 + warmdown 600
2026-03-21T07:30:24Z	20260321T073024Z_20260321T074300Z_runpod_h100_1gpu_l11_d496_untied_verify_stride256_int4a11s4wc1750_mwd0010	20260321T073024Z_20260321T074300Z_runpod_h100_1gpu_l11_d496_untied_verify_stride256_int4a11s4wc1750_mwd0010	runpod_h100	train_gpt.py	research/continuous-mar18	a52678d554d803bbb870d0ba832402b3449259a9	keep	0	1.23109826	1.2589	2.07865803	2.1256	14438101	58672	14379429	1750.374	3090	logs/experiments/20260321T073024Z_20260321T074300Z_runpod_h100_1gpu_l11_d496_untied_verify_stride256_int4a11s4wc1750_mwd0010.log		frontier compression topology: int4 layers 0-10 with step4 + muon_decay=0.0035 + warmdown 600
2026-03-21T08:12:40Z	20260321T081240Z_runpod_h100_1gpu_l11_d496_untied_verify_stride256_int4l9s3wc1750_mwd0011	20260321T081240Z_runpod_h100_1gpu_l11_d496_untied_verify_stride256_int4l9s3wc1750_mwd0011	runpod_h100	train_gpt.py	research/continuous-mar18	a52678d554d803bbb870d0ba832402b3449259a9	keep	0	1.22709176	1.2571	2.07189321	2.1225	15708999	58672	15650327	2195.333508	3091	logs/experiments/20260321T081240Z_runpod_h100_1gpu_l11_d496_untied_verify_stride256_int4l9s3wc1750_mwd0011.log		precision frontier continuation: first9 layers step3, eval_stride256 + verify baseline check
2026-03-21T08:49:57Z	20260321T084957Z_runpod_h100_1gpu_l11_d496_untied_verify_stride256_int4l9s3wc1800_int35_mwd0012	20260321T084957Z_runpod_h100_1gpu_l11_d496_untied_verify_stride256_int4l9s3wc1800_int35_mwd0012	runpod_h100	train_gpt.py	research/continuous-mar18	a52678d554d803bbb870d0ba832402b3449259a9	keep	0	1.22773451	1.2576	2.07297848	2.1234	15476410	58672	15417738	2193.257607	3094	logs/experiments/20260321T084957Z_runpod_h100_1gpu_l11_d496_untied_verify_stride256_int4l9s3wc1800_int35_mwd0012.log		frontier warmdown extension test from best frontier geometry
2026-03-21T10:04:27Z	20260321T092826Z_runpod_h100_1gpu_l11_d496_untied_verify_stride256_int4l9s3wc1750_mwd0013	20260321T092826Z_runpod_h100_1gpu_l11_d496_untied_verify_stride256_int4l9s3wc1750_mwd0013	runpod_h100	train_gpt.py	research/continuous-mar18	a52678d554d803bbb870d0ba832402b3449259a9	keep	0	1.22673114	1.2568	2.07128433	2.1221	15769049	58672	15710377	1750.12	3128	logs/experiments/20260321T092826Z_runpod_h100_1gpu_l11_d496_untied_verify_stride256_int4l9s3wc1750_mwd0013.log		frontier warmdown extension: step3 + muon 0.003 + warmdown1000 at 1750s
2026-03-21T10:10:18Z	20260321T100547Z_runpod_h100_1gpu_l11_d496_untied_verify_stride256_bs64_int4l9s3wc1750_mwd0014	20260321T100547Z_runpod_h100_1gpu_l11_d496_untied_verify_stride256_bs64_int4l9s3wc1750_mwd0014	runpod_h100	train_gpt.py	research/continuous-mar18	a52678d554d803bbb870d0ba832402b3449259a9	keep	0	1.22667724	1.2567	2.07119332	2.1219	15738200	58672	15679528	1750.191	3146	logs/experiments/20260321T100547Z_runpod_h100_1gpu_l11_d496_untied_verify_stride256_bs64_int4l9s3wc1750_mwd0014.log		frontier eval throughput test: EVAL_BATCH_SEQS=64 at stride256
2026-03-21T10:18:55Z	20260321T104353Z_runpod_h100_1gpu_l11_d496_untied_verify_stride256_bs80_int4l9s3wc1750_mwd0015	20260321T104353Z_runpod_h100_1gpu_l11_d496_untied_verify_stride256_bs80_int4l9s3wc1750_mwd0015	runpod_h100	train_gpt.py	research/continuous-mar18	a52678d554d803bbb870d0ba832402b3449259a9	keep	0	1.22604146	1.2561	2.07011984	2.1209	15730147	58672	15671475	1750.216	3140	logs/experiments/20260321T104353Z_runpod_h100_1gpu_l11_d496_untied_verify_stride256_bs80_int4l9s3wc1750_mwd0015.log		frontier eval throughput test: EVAL_BATCH_SEQS=80 at stride256
2026-03-21T11:30:00Z	20260321T112142Z_runpod_h100_1gpu_l11_d496_untied_verify_stride256_bs96_int4l9s3wc1750_mwd0016	20260321T112142Z_runpod_h100_1gpu_l11_d496_untied_verify_stride256_bs96_int4l9s3wc1750_mwd0016	runpod_h100	train_gpt.py	research/continuous-mar18	a52678d554d803bbb870d0ba832402b3449259a9	keep	0	1.22746549	1.2575	2.07252424	2.1233	15705679	58672	15647007	1750.273	3069	logs/experiments/20260321T112142Z_runpod_h100_1gpu_l11_d496_untied_verify_stride256_bs96_int4l9s3wc1750_mwd0016.log		frontier eval throughput test: EVAL_BATCH_SEQS=96 at stride256
2026-03-21T12:36:44Z	20260321T115941Z_runpod_h100_1gpu_l11_d496_untied_verify_stride256_bs80_int4l9s3wc1750_nofp16_mwd0017	20260321T115941Z_runpod_h100_1gpu_l11_d496_untied_verify_stride256_bs80_int4l9s3wc1750_nofp16_mwd0017	runpod_h100	train_gpt.py	research/continuous-mar18	a52678d554d803bbb870d0ba832402b3449259a9	keep	0	1.22620977	1.2562	2.07040402	2.121	15408917	58672	15350245	2188.556179	3183	logs/experiments/20260321T115941Z_runpod_h100_1gpu_l11_d496_untied_verify_stride256_bs80_int4l9s3wc1750_nofp16_mwd0017.log	logs/experiments/20260321T115941Z_runpod_h100_1gpu_l11_d496_untied_verify_stride256_bs80_int4l9s3wc1750_nofp16_mwd0017.json	frontier export variant: disable fp16 tied export
2026-03-21T13:18:15Z	20260321T124149Z_runpod_h100_1gpu_l11_d496_untied_verify_stride256_bs80_int4l9s2wc1750_mwd0019	20260321T124149Z_runpod_h100_1gpu_l11_d496_untied_verify_stride256_bs80_int4l9s2wc1750_mwd0019	runpod_h100	train_gpt.py	research/continuous-mar18	a52678d554d803bbb870d0ba832402b3449259a9	invalid	0	1.2241543	1.2544	2.06693344	2.118	16485097	58672	16426425	1750.175	3289	logs/experiments/20260321T124149Z_runpod_h100_1gpu_l11_d496_untied_verify_stride256_bs80_int4l9s2wc1750_mwd0019.log	logs/experiments/20260321T124149Z_runpod_h100_1gpu_l11_d496_untied_verify_stride256_bs80_int4l9s2wc1750_mwd0019.json	precision frontier: int4 step2 + fp16 tied export + int4_step2 + INT4_LAYERS0-8 + max_wallclock1750 | bytes_total>16000000
2026-03-21T13:55:13Z	20260321T131910Z_runpod_h100_1gpu_l11_d496_untied_verify_stride256_int4l6s2wc1750_mwd0021	20260321T131910Z_runpod_h100_1gpu_l11_d496_untied_verify_stride256_int4l6s2wc1750_mwd0021	runpod_h100	train_gpt.py	research/continuous-mar18	a65821f529ad1edf903ea7268857082c2b33e726	invalid	0	1.22384182	1.2543	2.06640582	2.1178	16948237	58672	16889565	2186.198855	3284	logs/experiments/20260321T131910Z_runpod_h100_1gpu_l11_d496_untied_verify_stride256_int4l6s2wc1750_mwd0021.log	logs/experiments/20260321T131910Z_runpod_h100_1gpu_l11_d496_untied_verify_stride256_int4l6s2wc1750_mwd0021.json	frontier compression-control: int4 layers0-6 step2 with fp16 tied export; explicit stride256+batch80 | bytes_total>16000000	
2026-03-21T14:35:00Z	20260321T135925Z_runpod_h100_1gpu_l11_d496_untied_verify_stride256_int4l6s3wc1750_mwd0022	20260321T135925Z_runpod_h100_1gpu_l11_d496_untied_verify_stride256_int4l6s3wc1750_mwd0022	trunpod_h100	train_gpt.py	research/continuous-mar18	1eec9058fc5985c479664a2a4b43ef144d4ccdce	invalid	0	1.22657876	1.2569	2.07102705	2.1222	16030526	58672	15971854	2186.386598	3110	logs/experiments/20260321T135925Z_runpod_h100_1gpu_l11_d496_untied_verify_stride256_int4l6s3wc1750_mwd0022.log	logs/experiments/20260321T135925Z_runpod_h100_1gpu_l11_d496_untied_verify_stride256_int4l6s3wc1750_mwd0022.json	frontier compression-control: int4 layers0-6 step3 with fp16 tied export; same budget 1750 | bytes_total>16000000	
2026-03-21T14:41:28Z	20260321T144128Z_runpod_h100_1gpu_l11_d496_untied_verify_stride256_int4l6s4wc1750_mwd0023	20260321T144128Z_runpod_h100_1gpu_l11_d496_untied_verify_stride256_int4l6s4wc1750_mwd0023	runpod_h100	train_gpt.py	research/continuous-mar18	1eec9058fc5985c479664a2a4b43ef144d4ccdce	keep	0	1.22658554	1.2561	2.07103849	2.1209	15570217	58672	15511545	2188.147336	3165	/Users/hansonwen/Library/CloudStorage/GoogleDrive-wenhanson0@gmail.com/My Drive/Clawd Workspace/OpenAI Parameter Golf/parameter-golf/logs/experiments/20260321T144128Z_runpod_h100_1gpu_l11_d496_untied_verify_stride256_int4l6s4wc1750_mwd0023.log		frontier compression-control: int4 layers0-6 step4 with fp16 tied export disabled
2026-03-21T15:18:42Z	20260321T151842Z_runpod_h100_1gpu_l11_d496_untied_verify_stride256_int4a8s4wc1750_mwd0024	20260321T151842Z_runpod_h100_1gpu_l11_d496_untied_verify_stride256_int4a8s4wc1750_mwd0024	runpod_h100	train_gpt.py	research/continuous-mar18	bb65b9c75f3e874eb391bda7fa72bd4da4db4126	keep	0	1.2270348	1.2561	2.07179705	2.1209	15211814	58672	15153142	2187.1048	3170	/Users/hansonwen/Library/CloudStorage/GoogleDrive-wenhanson0@gmail.com/My Drive/Clawd Workspace/OpenAI Parameter Golf/parameter-golf/logs/experiments/20260321T151842Z_runpod_h100_1gpu_l11_d496_untied_verify_stride256_int4a8s4wc1750_mwd0024.log		frontier quant coverage: int4 layers0-7 step4 with export roundtrip
2026-03-21T15:57:01Z	20260321T155701Z_runpod_h100_1gpu_l11_d496_untied_verify_stride256_int4l9s2wc1750_nofp16_mwd0026	20260321T155701Z_runpod_h100_1gpu_l11_d496_untied_verify_stride256_int4l9s2wc1750_nofp16_mwd0026	runpod_h100_1gpu	train_gpt.py	research/continuous-mar18	a52678d554d803bbb870d0ba832402b3449259a9	discard	0	1.23151324	1.2601	2.07935870	2.1277	13368283	58672	13309611	1975.073569	3379	/Users/hansonwen/Library/CloudStorage/GoogleDrive-wenhanson0@gmail.com/My Drive/Clawd Workspace/OpenAI Parameter Golf/parameter-golf/logs/experiments/20260321T155701Z_runpod_h100_1gpu_l11_d496_untied_verify_stride256_int4l9s2wc1750_nofp16_mwd0026.log		frontier quant-pressure: int4 layers 0-8 with step2, nofp16 tied export
2026-03-21T16:31:33Z	20260321T163133Z_runpod_h100_1gpu_l11_d496_untied_verify_stride256_int4l6s4wc1750_wd1800_mwd0027	20260321T163133Z_runpod_h100_1gpu_l11_d496_untied_verify_stride256_int4l6s4wc1750_wd1800_mwd0027	runpod_h100_1gpu	train_gpt.py	research/continuous-mar18	a52678d554d803bbb870d0ba832402b3449259a9	discard	0	1.2350572	1.2625	2.08534253	2.1316	12655367	58672	12596695	1974.532487	3243	logs/experiments/20260321T163133Z_runpod_h100_1gpu_l11_d496_untied_verify_stride256_int4l6s4wc1750_wd1800_mwd0027.log		wd1800_mwd0027
2026-03-21T17:08:54Z	20260321T170854Z_runpod_h100_1gpu_l11_d496_untied_verify_stride256_int4l7s4wc1750_mwd0028	20260321T170854Z_runpod_h100_1gpu_l11_d496_untied_verify_stride256_int4l7s4wc1750_mwd0028	runpod_h100	train_gpt.py	research/continuous-mar18	a52678d554d803bbb870d0ba832402b3449259a9	discard	0	1.23473342	1.2614	2.08479584	2.1298	12395071	58672	12336399	1988.804799	3346	logs/experiments/20260321T170854Z_runpod_h100_1gpu_l11_d496_untied_verify_stride256_int4l7s4wc1750_mwd0028.log		frontier int4 control: add layer7 at step4, fp16 tied export disabled
2026-03-21T17:42:56Z	20260321T174256Z_runpod_h100_1gpu_l11_d496_untied_verify_stride256_int4l6s4wc1750_mwd0029	20260321T174256Z_runpod_h100_1gpu_l11_d496_untied_verify_stride256_int4l6s4wc1750_mwd0029	runpod_h100	train_gpt.py	research/continuous-mar18	a52678d554d803bbb870d0ba832402b3449259a9	discard	0	1.23365113	1.2606	2.08296845	2.1285	12790814	58672	12732142	1973.308374	3343	logs/experiments/20260321T174256Z_runpod_h100_1gpu_l11_d496_untied_verify_stride256_int4l6s4wc1750_mwd0029.log		frontier export compare: keep fp16 tied export, int4 0..6 step4
2026-03-21T18:18:13Z	20260321T181813Z_runpod_h100_1gpu_l11_d496_untied_verify_stride256_int4l6s4wc1750_mwd0030	20260321T181813Z_runpod_h100_1gpu_l11_d496_untied_verify_stride256_int4l6s4wc1750_mwd0030	runpod_h100	train_gpt.py	research/continuous-mar18	a52678d554d803bbb870d0ba832402b3449259a9	discard	0	1.23117214	1.2588	2.07878277	2.1255	12835389	58672	12776717	1972.459778	3442	logs/experiments/20260321T181813Z_runpod_h100_1gpu_l11_d496_untied_verify_stride256_int4l6s4wc1750_mwd0030.log		frontier sweep: muon=0.0025, int4 0..6 step4 fp16 export
2026-03-21T18:53:46Z	20260321T185346Z_20260321T185300Z_runpod_h100_1gpu_l11_d496_untied_verify_stride256_int4l6s4wc1750_mwd0031	20260321T185346Z_20260321T185300Z_runpod_h100_1gpu_l11_d496_untied_verify_stride256_int4l6s4wc1750_mwd0031	runpod_h100	train_gpt.py	research/continuous-mar18	a52678d554d803bbb870d0ba832402b3449259a9	discard	0	1.23343581	1.2612	2.08260488	2.1295	12785393	58672	12726721	1974.809656	3455	logs/experiments/20260321T185346Z_20260321T185300Z_runpod_h100_1gpu_l11_d496_untied_verify_stride256_int4l6s4wc1750_mwd0031.log		frontier sweep: muon=0.0015, int4 0..6 step4 fp16 export + wd1800
