ts_utc	experiment_id	run_id	track	trainer	branch	commit	status	exit_code	exact_final_val_bpb	pre_quant_val_bpb	final_val_loss	pre_quant_val_loss	bytes_total	bytes_code	bytes_model	wallclock_seconds	step_stop	log_path	submission_path	notes
2026-03-20T05:04:20Z	20260320T050420Z_runpod_h100_1gpu_l11_d496_ue8_embed04	20260320T050420Z_runpod_h100_1gpu_l11_d496_ue8_embed04	runpod_h100_1gpu	train_gpt.py	research/continuous-mar18	52476a0ef480a222be3c57025b7c53dc3da79513	keep	0	1.32439830	1.3228	2.23619106	2.2336	14518394	47874	14470520	708.999606	1042	/workspace/parameter-golf/logs/experiments/20260320T050420Z_runpod_h100_1gpu_l11_d496_ue8_embed04.log		single hypothesis: EMBED_LR=0.4 on 11x496 untied
2026-03-20T05:17:05Z	20260320T051705Z_runpod_h100_1gpu_l11_d496_umatrix05	20260320T051705Z_runpod_h100_1gpu_l11_d496_umatrix05	runpod_h100_1gpu	train_gpt.py	research/continuous-mar18	52476a0ef480a222be3c57025b7c53dc3da79513	keep	0	1.32048871	1.3195	2.22958987	2.2278	15150670	47874	15102796	709.474112	1069	/workspace/parameter-golf/logs/experiments/20260320T051705Z_runpod_h100_1gpu_l11_d496_umatrix05.log		single hypothesis: MATRIX_LR=0.05 on 11x496 untied
2026-03-20T05:31:06Z	20260320T053106Z_runpod_h100_1gpu_l11_d496_umatrix03	20260320T053106Z_runpod_h100_1gpu_l11_d496_umatrix03	runpod_h100_1gpu	train_gpt.py	research/continuous-mar18	52476a0ef480a222be3c57025b7c53dc3da79513	keep	0	1.32698936	1.325	2.24056595	2.2372	13967763	47874	13919889	710.630429	1054	/workspace/parameter-golf/logs/experiments/20260320T053106Z_runpod_h100_1gpu_l11_d496_umatrix03.log		single hypothesis: MATRIX_LR=0.03 on 11x496 untied
2026-03-20T05:43:24Z	20260320T054324Z_runpod_h100_1gpu_l11_d496_uhead01	20260320T054324Z_runpod_h100_1gpu_l11_d496_uhead01	runpod_h100_1gpu	train_gpt.py	research/continuous-mar18	52476a0ef480a222be3c57025b7c53dc3da79513	keep	0	1.32345066	1.3221	2.23459101	2.2323	14568254	47874	14520380	708.331720	1044	/workspace/parameter-golf/logs/experiments/20260320T054324Z_runpod_h100_1gpu_l11_d496_uhead01.log		single hypothesis: HEAD_LR=0.01 on 11x496 untied
2026-03-20T05:57:06Z	20260320T055706Z_runpod_h100_1gpu_l11_d496_uscalar08	20260320T055706Z_runpod_h100_1gpu_l11_d496_uscalar08	runpod_h100_1gpu	train_gpt.py	research/continuous-mar18	52476a0ef480a222be3c57025b7c53dc3da79513	keep	0	1.32553081	1.3241	2.23810325	2.2357	14557389	47874	14509515	710.730255	1041	/workspace/parameter-golf/logs/experiments/20260320T055706Z_runpod_h100_1gpu_l11_d496_uscalar08.log		single hypothesis: SCALAR_LR=0.08 on 11x496 untied
2026-03-20T06:16:41Z	20260320T061641Z_runpod_h100_1gpu_l11_d496_uscalar06c	20260320T061641Z_runpod_h100_1gpu_l11_d496_uscalar06c	runpod_h100_1gpu	train_gpt.py	research/continuous-mar18	52476a0ef480a222be3c57025b7c53dc3da79513	discard	0	1.32352664	1.3222	2.23471929	2.2324	14596638	47874	14548764	709.745030	1051	/workspace/parameter-golf/logs/experiments/20260320T061641Z_runpod_h100_1gpu_l11_d496_uscalar06c.log		single hypothesis: SCALAR_LR=0.06 on 11x496 untied
2026-03-20T06:30:48Z	20260320T063048Z_runpod_h100_1gpu_l11_d496_umatrix06	20260320T063048Z_runpod_h100_1gpu_l11_d496_umatrix06	runpod_h100_1gpu	train_gpt.py	research/continuous-mar18	52476a0ef480a222be3c57025b7c53dc3da79513	discard	0	1.32140622	1.3205	2.23113904	2.2297	15596327	47874	15548453	709.101456	1054	/workspace/parameter-golf/logs/experiments/20260320T063048Z_runpod_h100_1gpu_l11_d496_umatrix06.log		single hypothesis: MATRIX_LR=0.06 on 11x496 untied
2026-03-20T06:58:02Z	20260320T065802Z_runpod_h100_1gpu_l11_d496_umatrix05h01c	20260320T065802Z_runpod_h100_1gpu_l11_d496_umatrix05h01c	runpod_h100_1gpu	train_gpt.py	research/continuous-mar18	4049855ca22881e0c0fd2b02186c58396fea2c90	crash	1						56766		48.343681		/workspace/parameter-golf/logs/experiments/20260320T065802Z_runpod_h100_1gpu_l11_d496_umatrix05h01c.log		single hypothesis: MATRIX_LR=0.05 with HEAD_LR=0.01 on 11x496 untied | exit_code=1
2026-03-20T06:57:57Z	20260320T065757Z_runpod_h100_1gpu_l11_d496_untied_slide64	20260320T065757Z_runpod_h100_1gpu_l11_d496_untied_slide64	runpod_h100_1gpu	train_gpt.py	research/continuous-mar18	4049855ca22881e0c0fd2b02186c58396fea2c90	crash	1		1.318		2.2254	14635605	56766	14578839	714.99958	1107	/workspace/parameter-golf/logs/experiments/20260320T065757Z_runpod_h100_1gpu_l11_d496_untied_slide64.log		low-hanging-fruit pivot: 11x496 untied with sliding-window exact eval stride=64 batch_seqs=64 after landing eval/export changes | exit_code=1
2026-03-20T07:29:53Z	20260320T072953Z_runpod_h100_1gpu_l11_d496_untied_verify	20260320T072953Z_runpod_h100_1gpu_l11_d496_untied_verify	runpod_h100_1gpu	train_gpt.py	research/continuous-mar18	70e130743d80233ec420779937b91e9585948837	crash	1		4.1052		6.9315		56848		144.146247	10	/workspace/parameter-golf/logs/experiments/20260320T072953Z_runpod_h100_1gpu_l11_d496_untied_verify.log		verify-export-path: retest best 11x496 untied with VERIFY_EXPORT_ROUNDTRIP=1 after device-mismatch fix | exit_code=1
2026-03-20T07:32:26Z	20260320T073226Z_runpod_h100_1gpu_l11_d496_untied_verify2	20260320T073226Z_runpod_h100_1gpu_l11_d496_untied_verify2	runpod_h100_1gpu	train_gpt.py	research/continuous-mar18	70e130743d80233ec420779937b91e9585948837	crash	1		4.1052		6.9315		56848		266.985116	200	/workspace/parameter-golf/logs/experiments/20260320T073226Z_runpod_h100_1gpu_l11_d496_untied_verify2.log		verify-export-path: validate best frontier with verify enabled after previous bugfix | exit_code=1
2026-03-20T07:37:04Z	20260320T073704Z_runpod_h100_1gpu_l11_d496_untied_verify3	20260320T073704Z_runpod_h100_1gpu_l11_d496_untied_verify3	runpod_h100_1gpu	train_gpt.py	research/continuous-mar18	70e130743d80233ec420779937b91e9585948837	keep	0	1.31193434	1.3107	2.21514632	2.213	15070268	56848	15013420	783.016748	1187	/workspace/parameter-golf/logs/experiments/20260320T073704Z_runpod_h100_1gpu_l11_d496_untied_verify3.log		verify-export-path: validate best frontier with verify enabled after fix (detached)
2026-03-20T07:52:33Z	20260320T075233Z_runpod_h100_1gpu_l11_d496_untied_verify_int4all4	20260320T075233Z_runpod_h100_1gpu_l11_d496_untied_verify_int4all4	runpod_h100	train_gpt.py	research/continuous-mar18	70e130743d80233ec420779937b91e9585948837	keep	0	1.32846427	1.3135	2.2430564	2.2178	11419963	56848	11363115	776.502659	1155	/workspace/parameter-golf/logs/experiments/20260320T075233Z_runpod_h100_1gpu_l11_d496_untied_verify_int4all4.log		int4-compression: all 11 layers int4_step=4 fp16_tied_embedding_export=1 verify roundtrip exact
2026-03-20T08:06:28Z	20260320T080628Z_runpod_h100_1gpu_l11_d496_untied_verify_int4_tail2	20260320T080628Z_runpod_h100_1gpu_l11_d496_untied_verify_int4_tail2	runpod_h100	train_gpt.py	research/continuous-mar18	70e130743d80233ec420779937b91e9585948837	keep	0	1.32080057	1.317	2.23011658	2.2237	14319783	56848	14262935	775.262712	1134	/workspace/parameter-golf/logs/experiments/20260320T080628Z_runpod_h100_1gpu_l11_d496_untied_verify_int4_tail2.log		int4-compression: layers 9,10 only; int4_step=4; verify exact
2026-03-20T08:35:42Z	20260320T083542Z_runpod_h100_1gpu_l11_d496_untied_verify_stride256_int4all2	20260320T083542Z_runpod_h100_1gpu_l11_d496_untied_verify_stride256_int4all2	runpod_h100	train_gpt.py	feat/baseline-direct	66fa9d9cb7b9f54fcf14cfa171feaf374851cc7c	keep	0	1.30962111	1.3375	2.21124039	2.2583	13250579	55483	13195096	797.572465	1086	/Users/hansonwen/Library/CloudStorage/GoogleDrive-wenhanson0@gmail.com/My Drive/Clawd Workspace/OpenAI Parameter Golf/parameter-golf/logs/experiments/20260320T083542Z_runpod_h100_1gpu_l11_d496_untied_verify_stride256_int4all2.log	/Users/hansonwen/Library/CloudStorage/GoogleDrive-wenhanson0@gmail.com/My Drive/Clawd Workspace/OpenAI Parameter Golf/parameter-golf/logs/experiments/20260320T083542Z_runpod_h100_1gpu_l11_d496_untied_verify_stride256_int4all2.json	int4-compression: all 11 layers int4_step=2 fp16_tied_embedding_export=1 verify exact; sliding eval stride/batch tune
2026-03-20T08:50:03Z	20260320T085003Z_runpod_h100_1gpu_l11_d496_untied_verify_stride256_int4all1	20260320T085003Z_runpod_h100_1gpu_l11_d496_untied_verify_stride256_int4all1	runpod_h100	train_gpt.py	feat/baseline-direct	66fa9d9cb7b9f54fcf14cfa171feaf374851cc7c	keep	0	1.29896417	1.3275	2.1932466	2.2415	13493894	55483	13438411	772.590117	1186	/Users/hansonwen/Library/CloudStorage/GoogleDrive-wenhanson0@gmail.com/My Drive/Clawd Workspace/OpenAI Parameter Golf/parameter-golf/logs/experiments/20260320T085003Z_runpod_h100_1gpu_l11_d496_untied_verify_stride256_int4all1.log	/Users/hansonwen/Library/CloudStorage/GoogleDrive-wenhanson0@gmail.com/My Drive/Clawd Workspace/OpenAI Parameter Golf/parameter-golf/logs/experiments/20260320T085003Z_runpod_h100_1gpu_l11_d496_untied_verify_stride256_int4all1.json	int4-compression: all 11 layers int4_step=1 fp16_tied_embedding_export=1 verify exact with stride/batch tune
2026-03-20T09:05:23Z	20260320T090523Z_runpod_h100_1gpu_l11_d496_untied_verify_stride256_int4half1	20260320T090523Z_runpod_h100_1gpu_l11_d496_untied_verify_stride256_int4half1	runpod_h100	train_gpt.py	feat/baseline-direct	66fa9d9cb7b9f54fcf14cfa171feaf374851cc7c	keep	0	1.30082265	1.3292	2.19638456	2.2443	13418850	55483	13363367	775.605728	1175	/Users/hansonwen/Library/CloudStorage/GoogleDrive-wenhanson0@gmail.com/My Drive/Clawd Workspace/OpenAI Parameter Golf/parameter-golf/logs/experiments/20260320T090523Z_runpod_h100_1gpu_l11_d496_untied_verify_stride256_int4half1.log	/Users/hansonwen/Library/CloudStorage/GoogleDrive-wenhanson0@gmail.com/My Drive/Clawd Workspace/OpenAI Parameter Golf/parameter-golf/logs/experiments/20260320T090523Z_runpod_h100_1gpu_l11_d496_untied_verify_stride256_int4half1.json	int4-compression: first 8 layers int4_step=1 fp16_tied_embedding_export=1 verify exact; sliding eval stride/batch tune
2026-03-20T09:18:57Z	20260320T091857Z_runpod_h100_1gpu_l11_d496_untied_verify_stride256_int4all1wd2400	20260320T091857Z_runpod_h100_1gpu_l11_d496_untied_verify_stride256_int4all1wd2400	runpod_h100	train_gpt.py	feat/baseline-direct	66fa9d9cb7b9f54fcf14cfa171feaf374851cc7c	keep	0	1.30667957	1.3345	2.20627372	2.2532	13291021	55483	13235538	776.47949	1125	/Users/hansonwen/Library/CloudStorage/GoogleDrive-wenhanson0@gmail.com/My Drive/Clawd Workspace/OpenAI Parameter Golf/parameter-golf/logs/experiments/20260320T091857Z_runpod_h100_1gpu_l11_d496_untied_verify_stride256_int4all1wd2400.log	/Users/hansonwen/Library/CloudStorage/GoogleDrive-wenhanson0@gmail.com/My Drive/Clawd Workspace/OpenAI Parameter Golf/parameter-golf/logs/experiments/20260320T091857Z_runpod_h100_1gpu_l11_d496_untied_verify_stride256_int4all1wd2400.json	int4-compression: all 11 layers int4_step=1 with warmdown 2400
2026-03-20T10:09:59Z	20260320T095859Z_runpod_h100_1gpu_l11_d496_untied_verify_stride256_int4all1_nofp16	20260320T095859Z_runpod_h100_1gpu_l11_d496_untied_verify_stride256_int4all1_nofp16	runpod_h100	train_gpt.py	feat/baseline-direct	66fa9d9cb7b9f54fcf14cfa171feaf374851cc7c	keep	0	1.30936417	1.3369	2.21080656	2.2574	13197119	55483	13141636	777.714801	1099	/Users/hansonwen/Library/CloudStorage/GoogleDrive-wenhanson0@gmail.com/My Drive/Clawd Workspace/OpenAI Parameter Golf/parameter-golf/logs/experiments/20260320T095859Z_runpod_h100_1gpu_l11_d496_untied_verify_stride256_int4all1_nofp16.log	/Users/hansonwen/Library/CloudStorage/GoogleDrive-wenhanson0@gmail.com/My Drive/Clawd Workspace/OpenAI Parameter Golf/parameter-golf/logs/experiments/20260320T095859Z_runpod_h100_1gpu_l11_d496_untied_verify_stride256_int4all1_nofp16.json	precision-compression check: all 11 layers int4_step=1 with FP16_TIED_EMBEDDING_EXPORT=0 under stride256 exact eval
2026-03-20T10:25:00Z	20260320T101240Z_runpod_h100_1gpu_l11_d496_untied_verify_stride256_int4all1_batch64	20260320T101240Z_runpod_h100_1gpu_l11_d496_untied_verify_stride256_int4all1_batch64	runpod_h100	train_gpt.py	feat/baseline-direct	66fa9d9cb7b9f54fcf14cfa171feaf374851cc7c	keep	0	1.30399119	1.3322	2.2017345	2.2494	13370697	55483	13315214	781.235508	1139	logs/experiments/20260320T101240Z_runpod_h100_1gpu_l11_d496_untied_verify_stride256_int4all1_batch64.log	logs/experiments/20260320T101240Z_runpod_h100_1gpu_l11_d496_untied_verify_stride256_int4all1_batch64.json	eval tuning: all 11 layers int4_step=1 fp16_tied_embedding_export=1 with eval_batch_seqs=64 under stride256 exact eval
2026-03-20T10:26:12Z	20260320T102612Z_runpod_h100_1gpu_l11_d496_untied_verify_stride256_int4all1wc900	20260320T102612Z_runpod_h100_1gpu_l11_d496_untied_verify_stride256_int4all1wc900	runpod_h100	train_gpt.py	feat/baseline-direct	66fa9d9cb7b9f54fcf14cfa171feaf374851cc7c	keep	0	1.26530376	1.2956	2.13641239	2.1875	14614808	55483	14559325	1076.49275	1710	logs/experiments/20260320T102612Z_runpod_h100_1gpu_l11_d496_untied_verify_stride256_int4all1wc900.log		wallclock extension: int4all1 fp16 export with EVAL_BATCH_SEQS=32 stride256 exact eval
2026-03-20T10:45:53Z	20260320T104553Z_runpod_h100_1gpu_l11_d496_untied_verify_stride256_int4all1wc1200	20260320T104553Z_runpod_h100_1gpu_l11_d496_untied_verify_stride256_int4all1wc1200	runpod_h100	train_gpt.py	research/continuous-mar18	70e130743d80233ec420779937b91e9585948837	invalid	0	1.23936419	1.2714	2.0926147	2.1466	17974723	56848	17917875	1634.185363	2082	logs/experiments/20260320T104553Z_runpod_h100_1gpu_l11_d496_untied_verify_stride256_int4all1wc1200.log		wallclock extension: int4all1 fp16 export with EVAL_BATCH_SEQS=32 stride256 exact eval (1200s cap); bytes cap invalid | bytes_total>16000000
2026-03-20T11:14:12Z	20260320T111412Z_runpod_h100_1gpu_l11_d496_untied_verify_stride256_int4all1wc1200b	20260320T111412Z_runpod_h100_1gpu_l11_d496_untied_verify_stride256_int4all1wc1200b	runpod_h100	train_gpt.py	feat/baseline-direct	66fa9d9cb7b9f54fcf14cfa171feaf374851cc7c	keep	0	1.24891423	1.2797	2.10873936	2.1607	15183423	55483	15127940	1395.928878	2079	logs/experiments/20260320T111412Z_runpod_h100_1gpu_l11_d496_untied_verify_stride256_int4all1wc1200b.log	logs/experiments/20260320T111412Z_runpod_h100_1gpu_l11_d496_untied_verify_stride256_int4all1wc1200b.json	wallclock extension on feat/baseline-valid revision (1200s cap)
2026-03-20T12:35:00Z		20260320T120707Z_runpod_h100_1gpu_l11_d496_untied_verify_stride256_int4all1wc1500	runpod_h100	train_gpt.py	feat/baseline-direct		keep	0	1.23415861	1.2652	2.08382512	2.1362	15792608	55483	15737125	1691.13778	2603	logs/experiments/20260320T120707Z_runpod_h100_1gpu_l11_d496_untied_verify_stride256_int4all1wc1500.log	logs/experiments/20260320T120707Z_runpod_h100_1gpu_l11_d496_untied_verify_stride256_int4all1wc1500.json	wallclock extension follow-through: 1500s cap, int4all1 fp16 tied embedding, stride256 exact eval
2026-03-20T13:10:00Z	20260320T123634Z_runpod_h100_1gpu_l11_d496_untied_verify_stride256_int4all1wc1800	20260320T123900Z_runpod_h100_1gpu_l11_d496_untied_verify_stride256_int4all1wc1800	runpod_h100	train_gpt.py	feat/baseline-direct		invalid	0	1.22595806	1.2566	2.06997883	2.1217	16113819	55483	16058336	2012.075081	3103	logs/experiments/20260320T123634Z_runpod_h100_1gpu_l11_d496_untied_verify_stride256_int4all1wc1800.log	logs/experiments/20260320T123634Z_runpod_h100_1gpu_l11_d496_untied_verify_stride256_int4all1wc1800.json	extended wallclock continuation at 1800s, all-layer int4_step=1, stride256 exact eval | bytes_total>16000000
2026-03-20T13:46:00Z	20260320T131234Z_runpod_h100_1gpu_l11_d496_untied_verify_stride256_int4all2wc1800	20260320T131200Z_runpod_h100_1gpu_l11_d496_untied_verify_stride256_int4all2wc1800	runpod_h100	train_gpt.py	feat/baseline-direct		invalid	0	1.22456297	1.2554	2.06762327	2.1197	16114350	55483	16058867	2008.459533	3130	logs/experiments/20260320T131234Z_runpod_h100_1gpu_l11_d496_untied_verify_stride256_int4all2wc1800.log	logs/experiments/20260320T131234Z_runpod_h100_1gpu_l11_d496_untied_verify_stride256_int4all2wc1800.json	extended wallclock with int4_step=2 to recover byte headroom at 1800s cap | bytes_total>16000000
2026-03-20T13:48:03Z	20260320T134803Z_runpod_h100_1gpu_l11_d496_untied_verify_stride256_int4all1wc1700	20260320T134803Z_runpod_h100_1gpu_l11_d496_untied_verify_stride256_int4all1wc1700	runpod_h100	train_gpt.py	research/continuous-mar18	66fa9d9cb7b9f54fcf14cfa171feaf374851cc7c	invalid	0	1.22841875	1.2591	2.0741336	2.1259	16040676	55483	15985193	1891.691481	2970	logs/experiments/20260320T134803Z_runpod_h100_1gpu_l11_d496_untied_verify_stride256_int4all1wc1700.log	logs/experiments/20260320T134803Z_runpod_h100_1gpu_l11_d496_untied_verify_stride256_int4all1wc1700.json	byte-control follow-up: keep all-layer int4_step=1 but cap 1700s to recover sub-16MB frontier | bytes_total>16000000
2026-03-20T14:20:35Z	20260320T142035Z_runpod_h100_1gpu_l11_d496_untied_verify_stride256_int4all1wc1800_nofp16	20260320T142035Z_runpod_h100_1gpu_l11_d496_untied_verify_stride256_int4all1wc1800_nofp16	runpod_h100	train_gpt.py	research/continuous-mar18	66fa9d9cb7b9f54fcf14cfa171feaf374851cc7c	invalid	0	1.22485899	1.2557	2.0681231	2.1201	16132911	55483	16077428	2007.78795	3131	logs/experiments/20260320T142035Z_runpod_h100_1gpu_l11_d496_untied_verify_stride256_int4all1wc1800_nofp16.log	logs/experiments/20260320T142035Z_runpod_h100_1gpu_l11_d496_untied_verify_stride256_int4all1wc1800_nofp16.json	RunPod frontier follow-up invalid by bytes with fp16 tied export disabled at 1800s | best_eligible_before=1.23415861 | bytes_total>16000000
2026-03-20T17:24:07Z	20260320T172407Z_runpod_h100_recover_l11_d496_untied_slide64	20260320T172407Z_runpod_h100_recover_l11_d496_untied_slide64	runpod_h100_1gpu	train_gpt.py	research/continuous-mar18	88ca4175db1516a6095d90581a519798b3510504	discard	0	1.29861814	1.3299	2.19265965	2.2455	14540049	58672	14481377	2022.914929	1049	/workspace/parameter-golf/logs/experiments/20260320T172407Z_runpod_h100_recover_l11_d496_untied_slide64.log		recover RunPod replacement pod: bootstrap cached sp1024 data then relaunch low-hanging-fruit 11x496 untied sliding-eval path
2026-03-20T18:04:24Z	20260320T180424Z_l11_d496_untied_verify_stride256_int4all2wc1650_tail	20260320T180424Z_l11_d496_untied_verify_stride256_int4all2wc1650_tail	runpod_h100_1gpu	train_gpt.py	research/continuous-mar18	88ca4175db1516a6095d90581a519798b3510504	invalid	0	1.22948341	1.2621	2.07593143	2.131	16094616	58672	16035944	1933.867444	3278	/Users/hansonwen/Library/CloudStorage/GoogleDrive-wenhanson0@gmail.com/My Drive/Clawd Workspace/OpenAI Parameter Golf/parameter-golf/logs/experiments/20260320T180424Z_l11_d496_untied_verify_stride256_int4all2wc1650_tail.log		parallel branch: int4all2 fp16 tied embed with 1650s cap, trading score for bytes under cap check | bytes_total>16000000
2026-03-20T18:04:24Z	20260320T180424Z_l11_d496_untied_verify_stride256_int4all1wc1650	20260320T180424Z_l11_d496_untied_verify_stride256_int4all1wc1650	runpod_h100_1gpu	train_gpt.py	research/continuous-mar18	70e130743d80233ec420779937b91e9585948837	crash	1							1453.972	2800	/Users/hansonwen/Library/CloudStorage/GoogleDrive-wenhanson0@gmail.com/My Drive/Clawd Workspace/OpenAI Parameter Golf/parameter-golf/logs/experiments/20260320T180424Z_l11_d496_untied_verify_stride256_int4all1wc1650.log		SIGTERM 15 during wallclock run; process terminated in torch.distributed elastic while still active (last logged step≈2800). No final exact metric or summary row produced.
2026-03-20T19:06:32Z	20260320T190632Z_runpod_h100_1gpu_l11_d496_untied_verify_stride256_int4all1wc1750_nofp16	20260320T190632Z_runpod_h100_1gpu_l11_d496_untied_verify_stride256_int4all1wc1750_nofp16	runpod_h100	train_gpt.py	research/continuous-mar18	a52678d554d803bbb870d0ba832402b3449259a9	invalid	0	1.22629901	1.2572	2.07055469	2.1227	18471099	58672	18412427	2203.996709	3181	/workspace/parameter-golf/logs/experiments/20260320T190632Z_runpod_h100_1gpu_l11_d496_untied_verify_stride256_int4all1wc1750_nofp16.log		precision-aware_continuation_nofp16_int4all1_1750 | bytes_total>16000000
2026-03-20T19:45:25Z	20260320T194525Z_runpod_h100_1gpu_l11_d496_untied_verify_stride256_int4all1wc1750_fp16	20260320T194525Z_runpod_h100_1gpu_l11_d496_untied_verify_stride256_int4all1wc1750_fp16	runpod_h100	train_gpt.py	research/continuous-mar18	a52678d554d803bbb870d0ba832402b3449259a9	invalid	0	1.22492057	1.2559	2.06822725	2.1205	18776285	58672	18717613	2206.595662	3256	/workspace/parameter-golf/logs/experiments/20260320T194525Z_runpod_h100_1gpu_l11_d496_untied_verify_stride256_int4all1wc1750_fp16.log		precision-aware_continuation_fp16_export_all1_1750 | bytes_total>16000000
2026-03-20T20:23:09Z	20260320T202309Z_runpod_h100_1gpu_l11_d496_untied_verify_stride256_int4l9wc1750	20260320T202309Z_runpod_h100_1gpu_l11_d496_untied_verify_stride256_int4l9wc1750	runpod_h100	train_gpt.py	research/continuous-mar18	a52678d554d803bbb870d0ba832402b3449259a9	invalid	0	1.22308526	1.2542	2.06512841	2.1176	18815357	58672	18756685	2190.451857	3405	/workspace/parameter-golf/logs/experiments/20260320T202309Z_runpod_h100_1gpu_l11_d496_untied_verify_stride256_int4l9wc1750.log		compression-pressure_l9_wc1750 | bytes_total>16000000
2026-03-20T21:03:39Z	20260320T210339Z_runpod_h100_1gpu_l11_d496_untied_verify_stride256_int4l9s2wc1750	20260320T211000Z_runpod_h100_1gpu_l11_d496_untied_verify_stride256_int4l9s2wc1750	runpod_h100	train_gpt.py	research/continuous-mar18	a52678d554d803bbb870d0ba832402b3449259a9	invalid	0	1.22371257	1.254	2.0661876	2.1173	16666804	58672	16608132	2194.291542	3436	/workspace/parameter-golf/logs/experiments/20260320T210339Z_runpod_h100_1gpu_l11_d496_untied_verify_stride256_int4l9s2wc1750.log		compression-pressure step2 for 9-layer int4 coverage at 1750s | bytes_total>16000000
