ts_utc	experiment_id	run_id	track	trainer	branch	commit	status	exit_code	exact_final_val_bpb	pre_quant_val_bpb	final_val_loss	pre_quant_val_loss	bytes_total	bytes_code	bytes_model	wallclock_seconds	step_stop	log_path	submission_path	notes
2026-03-21T20:05:43Z	20260321T192842Z_runpod_h100_1gpu_l11_d496_untied_verify_stride256_int4l6s4wc1750_mwd0032	20260321T192842Z_runpod_h100_1gpu_l11_d496_untied_verify_stride256_int4l6s4wc1750_mwd0032	runpod_h100	train_gpt.py	research/continuous-mar18	edee60642b12c2e33cd19e393d30fe4929a3e5df	discard	0	1.22707546	1.2563	2.0718657	2.1212	15639616	58672	15580944	2199.431579	3184	logs/experiments/20260321T192842Z_runpod_h100_1gpu_l11_d496_untied_verify_stride256_int4l6s4wc1750_mwd0032.log	logs/experiments/20260321T192842Z_runpod_h100_1gpu_l11_d496_untied_verify_stride256_int4l6s4wc1750_mwd0032.json	primary RunPod frontier probe: muon=0.004 with wd1800, fixed int4 topology
